{
  "schema": "cutepower.run-artifact/route_resolution/v1",
  "artifact_type": "route_resolution",
  "session_id": "run_20260422103716_8a1eb938",
  "route_id": "bug_fix_default",
  "phase": "route_resolved",
  "generated_at": "2026-04-22T10:37:16.696Z",
  "payload": {
    "entry_skill": "using-cutepower",
    "autostart_enabled": true,
    "engineering_signal_detected": true,
    "primary_type": "bug_fix",
    "primary_type_status": "resolved",
    "route_id": "bug_fix_default",
    "route_status": "resolved",
    "fallback_behavior": "fallback_when_cutepower_declines",
    "skill_chain": [
      "cute-scope-plan",
      "cute-repo-change",
      "cute-code-review",
      "cute-writeback"
    ]
  }
}
